{
  "active_camera_id": "scene_camera_multimodal_fusion_3d_template_camera_isome_490965bd",
  "cameras": [
    {
      "aspect": 1.5,
      "far": 10000.0,
      "fov_y_deg": 45.0,
      "id": "scene_camera_multimodal_fusion_3d_template_camera_isome_490965bd",
      "locked": false,
      "metadata": {},
      "name": "multimodal-fusion 3D template isometric camera",
      "near": 0.1,
      "ortho_height": 18.0,
      "position": [
        12.0,
        10.0,
        14.0
      ],
      "projection": "orthographic",
      "rotation": [
        0.0,
        0.0,
        0.0
      ],
      "target": [
        0.0,
        0.0,
        0.0
      ],
      "up": [
        0.0,
        1.0,
        0.0
      ]
    }
  ],
  "id": "scene_multimodal_fusion_3d_template_c03e3749",
  "layers": [
    {
      "groups": [],
      "id": "scene_layer_multimodal_fusion_3d_template_layer_model_9578af95",
      "locked": false,
      "metadata": {},
      "name": "Model",
      "objects": [
        {
          "geometry": {
            "center": [
              0.0,
              0.0,
              0.0
            ],
            "size": [
              17.0,
              11.0,
              8.0
            ]
          },
          "id": "scene_object_scene_template_multimodal_fusion_group_fra_4db1e141",
          "kind": "group-frame",
          "locked": false,
          "material": {
            "base_color": "#e2e8f0",
            "face_colors": {
              "front": "#e2e8f0",
              "top": "#e2e8f0"
            },
            "metallic": 0.0,
            "opacity": 0.025,
            "roughness": 0.9,
            "stroke_color": "#334155",
            "stroke_width": 0.8,
            "unlit": true
          },
          "metadata": {
            "architecture_family": "multimodal-fusion",
            "architecture_role": "group-frame",
            "decorative": true,
            "default_hidden_in_publication": true,
            "editable": true,
            "exclude_from_framing": true,
            "frame_role": "template-boundary",
            "model_fact": false,
            "template_only": true
          },
          "name": "Architecture group frame",
          "order": -100,
          "parent_group_id": null,
          "projections": [
            {
              "camera_id": "scene_camera_multimodal_fusion_3d_template_camera_isome_490965bd",
              "depth": -0.995824722854548,
              "ndc": [
                1.3158198810372225e-16,
                -9.868649107779169e-17,
                -0.995824722854548
              ],
              "point": [
                600.0000000000001,
                400.0
              ],
              "viewport": [
                1200.0,
                800.0
              ],
              "visible": true
            }
          ],
          "provenance": {
            "author_annotation": false,
            "evidence": {},
            "figure_ir_ids": [],
            "graph_ir_ids": [],
            "kind": "template",
            "reason": "Explicit editable Scene template; not model evidence.",
            "semantic_view_ids": [],
            "source_id": "scene-template:multimodal-fusion:group-frame"
          },
          "selected": false,
          "transform": {
            "position": [
              0.0,
              0.0,
              0.0
            ],
            "rotation": [
              0.0,
              0.0,
              0.0
            ],
            "scale": [
              1.0,
              1.0,
              1.0
            ]
          },
          "visible": true,
          "world": {
            "bounds_max": [
              8.5,
              5.5,
              4.0
            ],
            "bounds_min": [
              -8.5,
              -5.5,
              -4.0
            ],
            "matrix": [
              [
                1.0,
                0.0,
                0.0,
                0.0
              ],
              [
                0.0,
                1.0,
                0.0,
                0.0
              ],
              [
                0.0,
                0.0,
                1.0,
                0.0
              ],
              [
                0.0,
                0.0,
                0.0,
                1.0
              ]
            ],
            "position": [
              0.0,
              0.0,
              0.0
            ]
          }
        },
        {
          "geometry": {
            "center": [
              0.0,
              0.0,
              0.0
            ],
            "size": [
              2.0,
              1.6,
              2.0
            ]
          },
          "id": "scene_object_scene_template_multimodal_fusion_audio_enc_6b7f3403",
          "kind": "operation-block",
          "locked": false,
          "material": {
            "base_color": "#a7f3d0",
            "face_colors": {
              "front": "#a7f3d0",
              "top": "#a7f3d0"
            },
            "metallic": 0.0,
            "opacity": 1.0,
            "roughness": 0.9,
            "stroke_color": "#334155",
            "stroke_width": 0.8,
            "unlit": true
          },
          "metadata": {
            "architecture_family": "multimodal-fusion",
            "architecture_role": "audio-encoder",
            "editable": true,
            "modality": "audio",
            "model_fact": false,
            "template_only": true
          },
          "name": "Audio stream encoder",
          "order": 0,
          "parent_group_id": null,
          "projections": [
            {
              "camera_id": "scene_camera_multimodal_fusion_3d_template_camera_isome_490965bd",
              "depth": -0.995824722854548,
              "ndc": [
                -0.1406030745120918,
                0.3791976393296806,
                -0.995824722854548
              ],
              "point": [
                515.6381552927448,
                248.3209442681278
              ],
              "viewport": [
                1200.0,
                800.0
              ],
              "visible": true
            }
          ],
          "provenance": {
            "author_annotation": false,
            "evidence": {},
            "figure_ir_ids": [],
            "graph_ir_ids": [],
            "kind": "template",
            "reason": "Explicit editable Scene template; not model evidence.",
            "semantic_view_ids": [],
            "source_id": "scene-template:multimodal-fusion:audio-encoder"
          },
          "selected": false,
          "transform": {
            "position": [
              -2.5,
              3.0,
              0.0
            ],
            "rotation": [
              0.0,
              0.0,
              0.0
            ],
            "scale": [
              1.0,
              1.0,
              1.0
            ]
          },
          "visible": true,
          "world": {
            "bounds_max": [
              -1.5,
              3.8,
              1.0
            ],
            "bounds_min": [
              -3.5,
              2.2,
              -1.0
            ],
            "matrix": [
              [
                1.0,
                0.0,
                0.0,
                -2.5
              ],
              [
                0.0,
                1.0,
                0.0,
                3.0
              ],
              [
                0.0,
                0.0,
                1.0,
                0.0
              ],
              [
                0.0,
                0.0,
                0.0,
                1.0
              ]
            ],
            "position": [
              -2.5,
              3.0,
              0.0
            ]
          }
        },
        {
          "geometry": {
            "points": [
              [
                -1.5,
                3.0,
                0.0
              ],
              [
                0.4,
                0.0,
                0.0
              ]
            ],
            "radius": 0.07
          },
          "id": "scene_object_scene_template_multimodal_fusion_audio_fus_ef549cd8",
          "kind": "multimodal-stream",
          "locked": false,
          "material": {
            "base_color": "#a7f3d0",
            "face_colors": {
              "front": "#a7f3d0",
              "top": "#a7f3d0"
            },
            "metallic": 0.0,
            "opacity": 1.0,
            "roughness": 0.9,
            "stroke_color": "#a7f3d0",
            "stroke_width": 0.8,
            "unlit": true
          },
          "metadata": {
            "architecture_family": "multimodal-fusion",
            "architecture_role": "audio-fusion",
            "editable": true,
            "endpoint_object_ids": [
              "scene_object_scene_template_multimodal_fusion_audio_enc_6b7f3403",
              "scene_object_scene_template_multimodal_fusion_fusion_d51fd46a"
            ],
            "model_fact": false,
            "template_only": true
          },
          "name": "Modality enters fusion",
          "order": 0,
          "parent_group_id": null,
          "projections": [
            {
              "camera_id": "scene_camera_multimodal_fusion_3d_template_camera_isome_490965bd",
              "depth": -0.995824722854548,
              "ndc": [
                1.3158198810372225e-16,
                -9.868649107779169e-17,
                -0.995824722854548
              ],
              "point": [
                600.0000000000001,
                400.0
              ],
              "viewport": [
                1200.0,
                800.0
              ],
              "visible": true
            }
          ],
          "provenance": {
            "author_annotation": false,
            "evidence": {},
            "figure_ir_ids": [],
            "graph_ir_ids": [],
            "kind": "template",